DRS_POST,POST_AUTHOR,POST_TITLE,POST_PERMALINK,POST_RESOURCE_LINK,TOTAL_SHARES,TOTAL_POSTS,SHARES_ADDED,TIMESTAMP,TIMESTAMP_AS_EPOCH
1,paradox4286,"50 in CS, 13 more coming from Fidelity l, and 154 more in an IRA.",https://i.imgur.com/EF6BNx3.jpg,https://www.reddit.com/r/Superstonk/comments/q4gcgo/50_in_cs_13_more_coming_from_fidelity_l_and_154/,22766,104,50,2021-10-12 06:04:51,1634018691.0
2,ApocalypseMao,"Now that I have my purple circle, wen 741?",https://imgur.com/a/qXfnzD6,https://www.reddit.com/r/Superstonk/comments/q66lod/now_that_i_have_my_purple_circle_wen_741/,22716,103,4200,2021-10-12 05:56:27,1634018187.0
3,CountMatt,!drsbot XXX post just for this sorry :(,https://www.reddit.com/r/Superstonk/comments/q6fd0n/drsbot_xxx_post_just_for_this_sorry/,https://www.reddit.com/r/Superstonk/comments/q6fd0n/drsbot_xxx_post_just_for_this_sorry/,18516,102,40,2021-10-12 05:53:54,1634018034.0
4,white-rice77,"As a mid xxx holder I knew what had to do. can't stop, won't stop, GameStop",https://i.redd.it/r3gosldgjwq71.png,https://www.reddit.com/r/Superstonk/comments/pzgw2j/as_a_mid_xxx_holder_i_knew_what_had_to_do_cant/,18476,101,100,2021-10-12 05:49:43,1634017783.0
5,Mebs_RX7,"We in there! Ive got some left in IRA and Roth in Fidelity, anyone know how that works or if I'll be hit with fees and such if I move them too?",https://i.redd.it/wztpvjnbdhs71.jpg,https://www.reddit.com/r/Superstonk/comments/q4subl/we_in_there_ive_got_some_left_in_ira_and_roth_in/,18376,100,500,2021-10-12 05:47:54,1634017674.0
6,bucolucas,More than a little. Less than a lot.,https://i.imgur.com/YYpyl9t.png,https://www.reddit.com/r/Superstonk/comments/q6f2k8/more_than_a_little_less_than_a_lot/,17876,99,21,2021-10-12 05:32:57,1634016777.0
7,Skankhunt4422,Have another data point. I’ll hopefully take some karma in return.,https://i.redd.it/4s1zin2o5yr71.jpg,https://www.reddit.com/r/Superstonk/comments/q30796/have_another_data_point_ill_hopefully_take_some/,17855,98,10,2021-10-12 05:31:08,1634016668.0
8,Snoo_84586,Finally get to post this. My stonks are in my name :D,https://i.redd.it/eog8uz7h2hs71.png,https://www.reddit.com/r/Superstonk/comments/q4rnrs/finally_get_to_post_this_my_stonks_are_in_my_name/,17845,97,248,2021-10-12 05:26:07,1634016367.0
9,thecraftyastronaut,"We shall hodl with our diamond hands, and bone with our diamond dicks 💎 DRS IS THE ONLY WAY!",https://i.redd.it/c6w2zwcmygr71.jpg,https://www.reddit.com/r/Superstonk/comments/q1ae61/we_shall_hodl_with_our_diamond_hands_and_bone/,17597,96,11,2021-10-12 05:13:37,1634015617.0
10,LeadingCombination74,DRS Bot,https://www.reddit.com/r/Superstonk/comments/q6emy4/drs_bot/,https://www.reddit.com/r/Superstonk/comments/q6emy4/drs_bot/,17586,95,50,2021-10-12 05:09:34,1634015374.0
11,Arkayb33,I don't check my mail very often cause I have one of those neighborhood boxes and I'm lazy. But not too lazy to DRS my shares! 🚀 (resub cause I missed a barcode),https://i.redd.it/2gkewmnkmvs71.jpg,https://www.reddit.com/r/Superstonk/comments/q64aca/i_dont_check_my_mail_very_often_cause_i_have_one/,17536,94,75,2021-10-12 05:09:08,1634015348.0
12,Muerte_Blanca81,"Some were purchased, some were transferred. Let’s make these bitches pay!!!",https://i.redd.it/qu7gr2ifyjr71.jpg,https://www.reddit.com/r/Superstonk/comments/q1mlbv/some_were_purchased_some_were_transferred_lets/,17461,93,10,2021-10-12 05:01:33,1634014893.0
13,fiddle_time,TDA transferred finally.,https://i.redd.it/l3e85k4zmus71.jpg,https://www.reddit.com/r/Superstonk/comments/q5zvkv/tda_transferred_finally/,17451,92,16,2021-10-12 05:01:22,1634014882.0
14,Ok_Work1870,It’s not much but half is locked away and it feels so good to say that I finally have my very own registered GME shares! ☺️,https://i.redd.it/vrq60giyvjs71.jpg,https://www.reddit.com/r/Superstonk/comments/q512u0/its_not_much_but_half_is_locked_away_and_it_feels/,17435,91,35,2021-10-12 05:00:14,1634014814.0
15,alm4444,These aren’t the shares you’re looking for,https://i.redd.it/0r8bgfq2wws71.jpg,https://www.reddit.com/r/Superstonk/comments/q69j3b/these_arent_the_shares_youre_looking_for/,17400,90,500,2021-10-12 04:57:41,1634014661.0
16,designkase,I just want leave a record. To say I WAS THERE when it all went down. TO THE MOON!,https://i.redd.it/s2zdgojyy9s71.jpg,https://www.reddit.com/r/Superstonk/comments/q44i7n/i_just_want_leave_a_record_to_say_i_was_there/,16900,89,20,2021-10-12 04:57:33,1634014653.0
17,PsylohTheGrey,"268XXX Checking in! Forget the Karma, I’m surprised there were so many accounts created since mine… Keep them coming! Eyes on the Prize!",https://i.redd.it/mfsvmcm97vr71.jpg,https://www.reddit.com/r/Superstonk/comments/q2p76l/268xxx_checking_in_forget_the_karma_im_surprised/,16880,88,10,2021-10-12 04:50:49,1634014249.0
18,Omarology,We 95% all in bby see you apes on the moon 🚀,https://i.redd.it/thlyvs5i2bs71.jpg,https://www.reddit.com/r/Superstonk/comments/q48s7o/we_95_all_in_bby_see_you_apes_on_the_moon/,16870,87,100,2021-10-12 04:48:04,1634014084.0
19,DBuck42,"How to: Direct Registration (DRS) of shares to GME's transfer agent, Computershare, through Schwab. *Hopefully there's an easier way...",https://i.redd.it/214v9erniyg71.png,https://www.reddit.com/r/Superstonk/comments/p33w5s/how_to_direct_registration_drs_of_shares_to_gmes/,16770,86,79,2021-10-12 04:40:29,1634013629.0
20,Kindly_Act_4915,Just wanted to add my shares to the bot count,https://i.redd.it/na2imrka7ys71.jpg,https://www.reddit.com/r/Superstonk/comments/q6e848/just_wanted_to_add_my_shares_to_the_bot_count/,16691,85,10,2021-10-12 04:37:26,1634013446.0
21,Popcornbiatch,DRS in 2 days from Fidelity...FU Kenny!,https://i.redd.it/h4xaspo5bgp71.jpg,https://www.reddit.com/r/Superstonk/comments/puji2l/drs_in_2_days_from_fidelityfu_kenny/,16681,84,150,2021-10-12 04:34:38,1634013278.0
22,superheroninja,Here they cooooome 🌬📃,https://i.redd.it/zpsbkv6xiar71.jpg,https://www.reddit.com/r/Superstonk/comments/q0pdtp/here_they_cooooome/,16531,83,3011,2021-10-12 04:28:57,1634012937.0
23,_chareth-cutestory,I ♥️ getting sexy texts from Computershare 😏,https://i.redd.it/f1wxv8gq6gs71.jpg,https://www.reddit.com/r/Superstonk/comments/q4o62z/i_getting_sexy_texts_from_computershare/,13520,82,22,2021-10-12 04:21:15,1634012475.0
24,sneakyflamingy,"I know my ancestors are smiling upon me, can you say the same Kenneth? DRS IS THE WAY!! 🚀🚀",https://i.redd.it/0frj93893iq71.png,https://www.reddit.com/r/Superstonk/comments/py3rgv/i_know_my_ancestors_are_smiling_upon_me_can_you/,13498,81,81,2021-10-12 04:21:04,1634012464.0
25,22yards,"My first CS transfer. It is complete within 3 days from Fidelity (phone call method). Also, I like to round up to next number in binary sequence.",https://i.redd.it/cuq36t9p3cp71.jpg,https://www.reddit.com/r/Superstonk/comments/pu6zsr/my_first_cs_transfer_it_is_complete_within_3_days/,13417,80,1024,2021-10-12 04:19:25,1634012365.0
26,kendie2,Updated ComputerShare after my Vanguard shares hit 😀,https://imgur.com/LxU13NL,https://www.reddit.com/r/Superstonk/comments/q1d0w0/updated_computershare_after_my_vanguard_shares_hit/,12393,79,81,2021-10-12 04:17:10,1634012230.0
27,el_poopacabrah,"My forever shares made it to their final resting place, RIP dumbass 🚀",https://i.redd.it/18f3ep02g8s71.jpg,https://www.reddit.com/r/Superstonk/comments/q3ybua/my_forever_shares_made_it_to_their_final_resting/,12312,78,10,2021-10-12 04:16:58,1634012218.0
28,digibri,Couldn't figure out how to change the flair on my initial DRS post,https://i.redd.it/cgbljgrz2ys71.jpg,https://www.reddit.com/r/Superstonk/comments/q6dtem/couldnt_figure_out_how_to_change_the_flair_on_my/,12302,77,91,2021-10-12 04:13:23,1634012003.0
29,QuaggaSwagger,100 Shares to CS - FIDELITY HAS A SCRIPT,https://www.reddit.com/r/Superstonk/comments/ppkit0/100_shares_to_cs_fidelity_has_a_script/,https://www.reddit.com/r/Superstonk/comments/ppkit0/100_shares_to_cs_fidelity_has_a_script/,12211,76,100,2021-10-12 04:12:36,1634011956.0
30,LionRivr,Sold my criptoes back in April for these! LFG!,https://i.redd.it/onvach6xngq71.jpg,https://www.reddit.com/r/Superstonk/comments/pxxsqt/sold_my_criptoes_back_in_april_for_these_lfg/,12111,75,300,2021-10-12 04:04:49,1634011489.0
31,jnkboy64,Finally got all of my shares transferred. Went all in with computershare.,https://i.redd.it/dye3v8gx5qr71.png,https://www.reddit.com/r/Superstonk/comments/q29d7f/finally_got_all_of_my_shares_transferred_went_all/,11811,74,400,2021-10-12 04:00:40,1634011240.0
32,Special_Regular1596,"That’s just my take on it, I see no reason to sell registered shares if the float is locked up.",https://i.redd.it/38u7rie24bs71.jpg,https://www.reddit.com/r/Superstonk/comments/q48xq4/thats_just_my_take_on_it_i_see_no_reason_to_sell/,11411,73,102,2021-10-12 03:53:05,1634010785.0
33,l_Pulser_l,"Reposting for the count, sorry not sorry",https://i.redd.it/yjl6t8r0zxs71.jpg,https://www.reddit.com/r/Superstonk/comments/q6df1p/reposting_for_the_count_sorry_not_sorry/,11309,72,120,2021-10-12 03:52:02,1634010722.0
34,MarineMother,Old Mother Hubarb went to the cupboard to get her poor dog a bone. When she got there the cupboard had a fractional share in it,https://i.redd.it/whzehbjoyxs71.jpg,https://www.reddit.com/r/Superstonk/comments/q6dduq/old_mother_hubarb_went_to_the_cupboard_to_get_her/,11189,71,1,2021-10-12 03:49:54,1634010594.0
35,PipsMagoo002,Added another 50 to my initial 50. Felt good - might double again.,https://i.redd.it/zb4elbg2wxs71.jpg,https://www.reddit.com/r/Superstonk/comments/q6d4zx/added_another_50_to_my_initial_50_felt_good_might/,11188,70,50,2021-10-12 03:48:21,1634010501.0
36,fukthis_1,Purple cirbcle haha mmm,https://i.redd.it/n1qqvuq7ius71.jpg,https://www.reddit.com/r/Superstonk/comments/q5zab9/purple_cirbcle_haha_mmm/,11138,69,8,2021-10-12 03:48:20,1634010500.0
37,AstraiosMusic,AYYYYYYYEEEE LAMAYO,https://i.redd.it/xtv9xx78pvr71.jpg,https://www.reddit.com/r/Superstonk/comments/q2r71r/ayyyyyyyeeee_lamayo/,11130,68,44,2021-10-12 03:45:29,1634010329.0
38,UncleBenji,"DRS bot is active. Must be a comment in your own post, with the bot command !DRSBOT:XXX! with the CS flair! XXX is where you put in your DRS’d share count!!",https://i.redd.it/p4liqeflxxs71.jpg,https://www.reddit.com/r/Superstonk/comments/q6da94/drs_bot_is_active_must_be_a_comment_in_your_own/,11086,67,15,2021-10-12 03:44:35,1634010275.0
39,GoodShitBroBro,Another data point. Will have XXX DRS’d after next transfer,https://i.redd.it/m8wl42pfmvs71.jpg,https://www.reddit.com/r/Superstonk/comments/q649p6/another_data_point_will_have_xxx_drsd_after_next/,11071,66,46,2021-10-12 03:30:49,1634009449.0
40,Matterson7,"After 2 weeks and 2 attempts, the karma shall finally be mine. My body is ready!",https://i.redd.it/5j5aoqpprxs71.jpg,https://www.reddit.com/r/Superstonk/comments/q6cpp3/after_2_weeks_and_2_attempts_the_karma_shall/,11025,65,10,2021-10-12 03:30:17,1634009417.0
41,NewportMentholShorts,FINALLY WENT THROUGH FROM TDA 💪🏽🦍🚀,https://i.redd.it/rpfa6p3kaas71.jpg,https://www.reddit.com/r/Superstonk/comments/q45srv/finally_went_through_from_tda/,11015,64,20,2021-10-12 03:26:26,1634009186.0
42,Worth-Draft8909,Nice purple cock ring 🦍🚀,https://i.redd.it/6tbuxmx23ws71.jpg,https://www.reddit.com/r/Superstonk/comments/q66btn/nice_purple_cock_ring/,10995,63,28,2021-10-12 03:20:10,1634008810.0
43,DasTooth,First test batch has arrived safely. Feels good like I knew it would! Second will be initiated Monday.,https://i.redd.it/c85v1te1hbs71.jpg,https://www.reddit.com/r/Superstonk/comments/q4a7zw/first_test_batch_has_arrived_safely_feels_good/,10967,62,73,2021-10-12 03:12:38,1634008358.0
44,Ballistic_B,DRS Complete! 7 minute phone call to Fidelity and 30 hours later here we are,https://www.reddit.com/gallery/q2qrzz,https://www.reddit.com/r/Superstonk/comments/q2qrzz/drs_complete_7_minute_phone_call_to_fidelity_and/,10894,61,140,2021-10-12 03:07:12,1634008032.0
45,SauceyTaunTaun,Ape noises!!! 21 days to transfer from TDA - 150 moved over so far. LFG!!!!!!!,https://i.redd.it/r9spimrtfws71.jpg,https://www.reddit.com/r/Superstonk/comments/q67s5t/ape_noises_21_days_to_transfer_from_tda_150_moved/,10754,60,150,2021-10-12 03:04:49,1634007889.0
46,Justvibin4444,I ain’t no bystander! TDA—>Fidelity—>CS First batch finally landed!,https://i.redd.it/i0kv3mpxhxs71.jpg,https://www.reddit.com/r/Superstonk/comments/q6bqem/i_aint_no_bystander_tdafidelitycs_first_batch/,10604,59,105,2021-10-12 03:04:24,1634007864.0
47,MayB_anAd,"I originally just commented about my CS transfer being complete, but apparently you have to have a full post to be included in the DRS bot...",https://i.redd.it/8vgp1lmroxs71.jpg,https://www.reddit.com/r/Superstonk/comments/q6cfl3/i_originally_just_commented_about_my_cs_transfer/,10499,58,50,2021-10-12 02:55:03,1634007303.0
48,FunklerLing,80% 🛫➡️🛬 CS 💜,https://i.redd.it/ccnkgbakzbs71.jpg,https://www.reddit.com/r/Superstonk/comments/q4bvwz/80_cs/,10449,57,70,2021-10-12 02:54:42,1634007282.0
49,Mikeymikers0n,"Love to see ""DTC Stock Withdrawals"". Here's my initial 12. --- 60 more are en route 👉👌🌈🧸",https://i.redd.it/42k3fovyn9p71.png,https://www.reddit.com/r/Superstonk/comments/ptwzd1/love_to_see_dtc_stock_withdrawals_heres_my/,10379,56,12,2021-10-12 02:54:33,1634007273.0
50,polarfetus,Every share counts!! DRS is the way. Own your shares!,https://i.redd.it/0ptmrmshe2s71.png,https://www.reddit.com/r/Superstonk/comments/q3ecz9/every_share_counts_drs_is_the_way_own_your_shares/,10367,55,100,2021-10-12 02:52:27,1634007147.0
51,h4y6d2e,"“Now, I am become DRS, the destroyer of DTC fuckery.”",https://i.redd.it/1q3dvqm68vq71.jpg,https://www.reddit.com/r/Superstonk/comments/pzbngx/now_i_am_become_drs_the_destroyer_of_dtc_fuckery/,10267,54,100,2021-10-12 02:49:33,1634006973.0
52,Prestigious_Ship6853,someone turn the volume up,https://www.reddit.com/r/Superstonk/comments/q3ybo3/someone_turn_the_volume_up/,https://www.reddit.com/r/Superstonk/comments/q3ybo3/someone_turn_the_volume_up/,10167,53,155,2021-10-12 02:47:14,1634006834.0
53,mr-frog-24,Second share transfer complete. DRS ComputerShare.,https://www.reddit.com/gallery/pzp2iu,https://www.reddit.com/r/Superstonk/comments/pzp2iu/second_share_transfer_complete_drs_computershare/,10012,52,700,2021-10-12 02:44:52,1634006692.0
54,Monnarc1,Huzzah! Little by little,https://i.redd.it/4hpxtneqmgr71.jpg,https://www.reddit.com/r/Superstonk/comments/q18xpn/huzzah_little_by_little/,9312,51,4,2021-10-12 02:44:36,1634006676.0
55,Zensen1,What bystander effect? My second round went thru faster than expected from schwab (3 biz days)!!,https://i.redd.it/imfb8t5j21s71.png,https://www.reddit.com/r/Superstonk/comments/q38so6/what_bystander_effect_my_second_round_went_thru/,9308,50,166,2021-10-12 02:43:18,1634006598.0
56,jforest1,Finally!!! DRS from E*TRADE after 2 weeks of waiting. Now give me my karma. :D,https://v.redd.it/xga4j2l56oq71,https://www.reddit.com/r/Superstonk/comments/pynpke/finally_drs_from_etrade_after_2_weeks_of_waiting/,9142,49,8,2021-10-12 02:41:55,1634006515.0
57,GetInTheCarMa,"No updoots needed, posting DRS'ed shares to be included in the count.",https://i.redd.it/yyp4f73xpis71.png,https://www.reddit.com/r/Superstonk/comments/q4xmg6/no_updoots_needed_posting_drsed_shares_to_be/,9134,48,3904,2021-10-12 02:39:47,1634006387.0
58,Alexstrazsa,"Was a bit nervous, but finally pulled the trigger. 50% locked up! Account 476XXX",https://i.redd.it/eqs2wirv02s71.png,https://www.reddit.com/r/Superstonk/comments/q3cqgf/was_a_bit_nervous_but_finally_pulled_the_trigger/,5230,47,20,2021-10-12 02:36:35,1634006195.0
59,[deleted],!DRS:220!,https://i.redd.it/wsw21h4jlxs71.jpg,https://www.reddit.com/r/Superstonk/comments/q6c3kj/drs220/,5210,46,370,2021-10-12 02:35:32,1634006132.0
60,birsnot718,Finalllly in the Purple syzurpp club 💜💎🎊,https://i.redd.it/gbxv7tew2ws71.jpg,https://www.reddit.com/r/Superstonk/comments/q66c2t/finalllly_in_the_purple_syzurpp_club/,4840,45,120,2021-10-12 02:20:58,1634005258.0
61,irishdud1,PI shares locked away for the grandkids.,https://i.redd.it/6nociygrhxs71.png,https://www.reddit.com/r/Superstonk/comments/q6bpr3/pi_shares_locked_away_for_the_grandkids/,4720,44,314,2021-10-12 02:15:14,1634004914.0
62,whoaitsnick915,"Fidelity Paper Transfer to ComputerShares from Last Week - 50 to the Pool, XXX Left 💎🙌🏻🚀🦍",https://i.redd.it/us300d4jrwn71.jpg,https://www.reddit.com/r/Superstonk/comments/ppiztx/fidelity_paper_transfer_to_computershares_from/,4406,43,50,2021-10-12 02:06:24,1634004384.0
63,EasilyAnonymous,Yeah baby! LFG!,https://i.redd.it/jmyuqxfewbr71.jpg,https://www.reddit.com/r/Superstonk/comments/q0uiud/yeah_baby_lfg/,4356,42,10,2021-10-12 01:55:46,1634003746.0
64,Holiday_Guess_7892,Second wave from Fidelity... Sending more next week.,https://i.redd.it/2cqtqmixm1s71.jpg,https://www.reddit.com/r/Superstonk/comments/q3b2vs/second_wave_from_fidelity_sending_more_next_week/,4346,41,400,2021-10-12 01:54:04,1634003644.0
65,beachplzzz,"DRS 40 tickets....It's not high score worthy, but it's an honest effort!....(Canadian Ape transfer from Questrade --> 🖥️ share)",https://i.redd.it/bv8fbjmyi9q71.png,https://www.reddit.com/r/Superstonk/comments/px8urc/drs_40_ticketsits_not_high_score_worthy_but_its/,3946,40,40,2021-10-12 01:46:58,1634003218.0
66,twin_turbo_monkey,"100 is the best I can do for DRS. Rest are in Traditional/Roth and won’t be moved over until there is solid evidence we can transfer in-kind without taxable event. Sorry, I’m maxed out for tax consequences and can’t risk any more this year — January Ape",https://i.redd.it/aso7oqxo7qr71.jpg,https://www.reddit.com/r/Superstonk/comments/q29j5p/100_is_the_best_i_can_do_for_drs_rest_are_in/,3906,39,102,2021-10-12 01:44:01,1634003041.0
67,m3talrocksFPV,someone created a drs counting bot. Instructions are in the photo,https://i.redd.it/l4sou51b6xs71.jpg,https://www.reddit.com/r/Superstonk/comments/q6akje/someone_created_a_drs_counting_bot_instructions/,3804,38,70,2021-10-12 01:34:57,1634002497.0
68,CaptBiscuits,Was asked to post video proof~ I still have XX shares coming in as well! These will never be sold! I’ll never stop buying because I BELIEVE in this company. Get REKT Kenny 🚀,https://v.redd.it/h86sukdvdas71,https://www.reddit.com/r/Superstonk/comments/q465vw/was_asked_to_post_video_proof_i_still_have_xx/,3734,37,117,2021-10-12 01:23:22,1634001802.0
69,DrPoonicorn,It feels like I can just reach out and touch them.🚀,https://imgur.com/yWrZcpk,https://www.reddit.com/r/Superstonk/comments/q69xlo/it_feels_like_i_can_just_reach_out_and_touch_them/,3617,36,15,2021-10-12 01:02:56,1634000576.0
70,m3talrocksFPV,I called at nearly 9pm last Friday to initiate this transfer from fidelity (call log in post history). Anyone who's afraid it'll take too long need not worry. I'm planning on doing 90% total transfer.,https://i.redd.it/if5qj7k76po71.jpg,https://www.reddit.com/r/Superstonk/comments/ps04dx/i_called_at_nearly_9pm_last_friday_to_initiate/,3605,36,8,2021-10-12 00:57:52,1634000272.0
71,RJSaddington,My amazing Diamond handed Apette daughter doesn't have enough karma to post but wanted me to show you this!!! 100% DRS!,https://i.redd.it/i8jshrrxmws71.jpg,https://www.reddit.com/r/Superstonk/comments/q68le7/my_amazing_diamond_handed_apette_daughter_doesnt/,3594,34,5,2021-10-12 00:23:44,1633998224.0
72,PierceTheGameTrader,my 100 shares finally arrived from TDameritrade! 200 more coming soon after they transfer outta TDA.,https://i.redd.it/9bmurv64nws71.png,https://www.reddit.com/r/Superstonk/comments/q68lrs/my_100_shares_finally_arrived_from_tdameritrade/,3589,33,100,2021-10-12 00:22:43,1633998163.0
73,TraditionalWorking82,Initial purchase was completed last week. Just finally got through to Fidelity to transfer another XX. DRS is the way!,https://i.redd.it/gsgd5lb6nts71.jpg,https://www.reddit.com/r/Superstonk/comments/q5vmrg/initial_purchase_was_completed_last_week_just/,3489,32,4,2021-10-12 00:07:32,1633997252.0
74,tonipaz,"Was going to wait for my 40 shares from Fidelity to come before posting but then I remembered I bought exactly 1 share directly to open my acct. so here you go, apes!",https://i.redd.it/z14va67uqws71.jpg,https://www.reddit.com/r/Superstonk/comments/q68z9n/was_going_to_wait_for_my_40_shares_from_fidelity/,3485,31,1,2021-10-12 00:05:45,1633997145.0
75,thisismyworkact,DRS from TDA complete :),https://i.redd.it/nw5kwlrrrws71.jpg,https://www.reddit.com/r/Superstonk/comments/q692kd/drs_from_tda_complete/,3484,30,6,2021-10-12 00:01:45,1633996905.0
76,Zero_Talents,"Yesterday Was The First Day I Could Finally Comment Here. Miraculously By Dumb Luck, Today Is The First Day I Can Post Here! I Offer You All, My Purple Circle! Love All You Apes & Love Being Part Of This Community!",https://i.redd.it/0x2ozkgvcws71.jpg,https://www.reddit.com/r/Superstonk/comments/q67hnq/yesterday_was_the_first_day_i_could_finally/,3478,29,60,2021-10-11 22:31:17,1633991477.0
77,_________ale,Added more to the ♾️🏊 DRS IS THE WAY 🚀,https://v.redd.it/lvmjyzsccws71,https://www.reddit.com/r/Superstonk/comments/q67fo0/added_more_to_the_drs_is_the_way/,3418,28,155,2021-10-11 22:30:37,1633991437.0
78,BigToyCoooooolin,Purple circle 🟣,https://i.redd.it/gz54ijcvbws71.jpg,https://www.reddit.com/r/Superstonk/comments/q67cnc/purple_circle/,3263,27,40,2021-10-11 22:25:54,1633991154.0
79,theRoman028,Easy. It's because I love playing games AND watching movies.,https://i.redd.it/32ad01kqkus71.png,https://www.reddit.com/r/Superstonk/comments/q5zm23/easy_its_because_i_love_playing_games_and/,3223,26,171,2021-10-11 21:52:11,1633989131.0
80,KokoJumboMoonUnit,TDA quoted 2-3 weeks to DRS. 13 business days and they are now in the purple circle of trust. Now I’ll proceed to DRS the next xxx to keep the pressure building up (thanks Criand),https://i.redd.it/pcia22hvzvs71.jpg,https://www.reddit.com/r/Superstonk/comments/q65xl2/tda_quoted_23_weeks_to_drs_13_business_days_and/,3052,25,241,2021-10-11 21:32:49,1633987969.0
81,king4aday,My new favorite color: Dark Purple!,https://i.imgur.com/v5x9pWU.jpg,https://www.reddit.com/r/Superstonk/comments/q65xra/my_new_favorite_color_dark_purple/,2811,24,100,2021-10-11 21:30:45,1633987845.0
82,Tonkskreacher,"125 for Alex Kearnsin perpetuity, 125 for my family and friends. Transferred the rest out of tda to fidelity today. 250 more coming when it's finished. Only buying through Computershare from now on. I really like this stonk.",https://v.redd.it/9fp8vv1povs71,https://www.reddit.com/r/Superstonk/comments/q64kuc/125_for_alex_kearnsin_perpetuity_125_for_my/,2711,23,250,2021-10-11 21:17:46,1633987066.0
83,gauravgulati2019,"Doing my part. Computershare Acc created. 10 GME DRSed, from Fidelity. Another xxxx (95% portfolio) on way. Added more images for 🦍🦍 entertainment. Don't need any fake internet points. 🚀🚀🚀🦍🦍🍻🚀🚀🚀",https://www.reddit.com/gallery/q61hvw,https://www.reddit.com/r/Superstonk/comments/q61hvw/doing_my_part_computershare_acc_created_10_gme/,2461,22,10,2021-10-11 20:36:08,1633984568.0
84,ishred5,Transfer for XXX more went through today…LFG!!!,https://i.redd.it/15of76js9vs71.jpg,https://www.reddit.com/r/Superstonk/comments/q62o9m/transfer_for_xxx_more_went_through_todaylfg/,2451,21,161,2021-10-11 20:32:52,1633984372.0
85,Dull_Shift,DRS is de way. 50 more getting DRS'ed this week,https://i.redd.it/omz19ws0ovs71.png,https://www.reddit.com/r/Superstonk/comments/q64i7c/drs_is_de_way_50_more_getting_drsed_this_week/,2290,20,105,2021-10-11 20:28:21,1633984101.0
86,Roid_Rage_Smurf,DRSBOT TEST POST,https://www.reddit.com/r/pythonforengineers/comments/q60y6q/drsbot_test_post/,https://www.reddit.com/r/pythonforengineers/comments/q60y6q/drsbot_test_post/,3294,21,111,2021-10-11 20:13:20,1633983200.0
87,[deleted],This is a test post !DRSBOT:234!,https://www.reddit.com/r/pythonforengineers/comments/q5a9tw/this_is_a_test_post_drsbot234/,https://www.reddit.com/r/pythonforengineers/comments/q5a9tw/this_is_a_test_post_drsbot234/,3183,20,998,2021-10-11 20:13:18,1633983198.0
88,Roid_Rage_Smurf,DRSBOT TEST POST,https://www.reddit.com/r/pythonforengineers/comments/q60y6q/drsbot_test_post/,https://www.reddit.com/r/pythonforengineers/comments/q60y6q/drsbot_test_post/,3294,21,111,2021-10-11 20:11:47,1633983107.0
89,[deleted],This is a test post !DRSBOT:234!,https://www.reddit.com/r/pythonforengineers/comments/q5a9tw/this_is_a_test_post_drsbot234/,https://www.reddit.com/r/pythonforengineers/comments/q5a9tw/this_is_a_test_post_drsbot234/,3183,20,998,2021-10-11 20:11:44,1633983104.0
90,Roid_Rage_Smurf,DRSBOT TEST POST,https://www.reddit.com/r/pythonforengineers/comments/q60y6q/drsbot_test_post/,https://www.reddit.com/r/pythonforengineers/comments/q60y6q/drsbot_test_post/,3294,21,111,2021-10-11 19:58:59,1633982339.0
91,[deleted],This is a test post !DRSBOT:234!,https://www.reddit.com/r/pythonforengineers/comments/q5a9tw/this_is_a_test_post_drsbot234/,https://www.reddit.com/r/pythonforengineers/comments/q5a9tw/this_is_a_test_post_drsbot234/,3183,20,998,2021-10-11 19:58:57,1633982337.0
92,Roid_Rage_Smurf,DRSBOT TEST POST,https://www.reddit.com/r/pythonforengineers/comments/q60y6q/drsbot_test_post/,https://www.reddit.com/r/pythonforengineers/comments/q60y6q/drsbot_test_post/,3294,21,111,2021-10-11 19:53:59,1633982039.0
